[
  {
    "name": "ochiai_fault_suspiciousness",
    "param_types": [
      "int",
      "int",
      "int"
    ],
    "return_type": "float",
    "summary": "Compute Ochiai spectrum-based fault localization (SBFL) suspiciousness score for a code line.",
    "pseudocode": "Algorithm ochiai_fault_suspiciousness(int, int, int) -> float:\n1. Receive typed arguments (int, int, int)\n2. Execute canonical calculation\n3. Return float",
    "invariants": [
      "0.0 <= out <= 1.0 + 1e-9",
      "f(0, nf, ep) == 0.0"
    ],
    "pitfalls": [
      {
        "naive_pattern": "Unclamped division or unguarded zero/negative denominator in agent telemetry.",
        "failure_mechanism": "ZeroDivisionError or out-of-bounds score on degenerate inputs.",
        "counterexample_input": "0",
        "verified_fix": "Clamp denominator and domain boundaries before arithmetic evaluation."
      }
    ],
    "source_code": "def ochiai_fault_suspiciousness(ef: int, nf: int, ep: int) -> float:\n    e_f = max(0, int(ef))\n    n_f = max(0, int(nf))\n    e_p = max(0, int(ep))\n    total_failed = e_f + n_f\n    total_executed = e_f + e_p\n    if e_f == 0 or total_failed == 0 or total_executed == 0:\n        return 0.0\n    denom = (float(total_failed) * float(total_executed)) ** 0.5\n    return e_f / denom",
    "domain": "agentic_reasoning"
  },
  {
    "name": "tarantula_fault_suspiciousness",
    "param_types": [
      "int",
      "int",
      "int",
      "int"
    ],
    "return_type": "float",
    "summary": "Compute Tarantula spectrum-based fault localization suspiciousness score from test pass/fail counts.",
    "pseudocode": "Algorithm tarantula_fault_suspiciousness(int, int, int, int) -> float:\n1. Receive typed arguments (int, int, int, int)\n2. Execute canonical calculation\n3. Return float",
    "invariants": [
      "0.0 <= out <= 1.0",
      "f(0, nf, ep, np_count) == 0.0"
    ],
    "pitfalls": [
      {
        "naive_pattern": "Unclamped division or unguarded zero/negative denominator in agent telemetry.",
        "failure_mechanism": "ZeroDivisionError or out-of-bounds score on degenerate inputs.",
        "counterexample_input": "0",
        "verified_fix": "Clamp denominator and domain boundaries before arithmetic evaluation."
      }
    ],
    "source_code": "def tarantula_fault_suspiciousness(ef: int, nf: int, ep: int, np_count: int) -> float:\n    e_f = max(0, int(ef))\n    n_f = max(0, int(nf))\n    e_p = max(0, int(ep))\n    n_p = max(0, int(np_count))\n    total_f = e_f + n_f\n    total_p = e_p + n_p\n    if total_f == 0 or e_f == 0:\n        return 0.0\n    fail_ratio = e_f / float(total_f)\n    if total_p == 0:\n        return 1.0\n    pass_ratio = e_p / float(total_p)\n    if fail_ratio + pass_ratio == 0.0:\n        return 0.0\n    return fail_ratio / (fail_ratio + pass_ratio)",
    "domain": "agentic_reasoning"
  },
  {
    "name": "bayesian_hypothesis_posterior",
    "param_types": [
      "float",
      "float",
      "float"
    ],
    "return_type": "float",
    "summary": "Update root-cause hypothesis probability via Bayes rule given prior and diagnostic test likelihoods.",
    "pseudocode": "Algorithm bayesian_hypothesis_posterior(float, float, float) -> float:\n1. Receive typed arguments (float, float, float)\n2. Execute canonical calculation\n3. Return float",
    "invariants": [
      "0.0 <= out <= 1.0",
      "f(0.0, likelihood_if_true, likelihood_if_false) == 0.0"
    ],
    "pitfalls": [
      {
        "naive_pattern": "Unclamped division or unguarded zero/negative denominator in agent telemetry.",
        "failure_mechanism": "ZeroDivisionError or out-of-bounds score on degenerate inputs.",
        "counterexample_input": "0",
        "verified_fix": "Clamp denominator and domain boundaries before arithmetic evaluation."
      }
    ],
    "source_code": "def bayesian_hypothesis_posterior(prior: float, likelihood_if_true: float, likelihood_if_false: float) -> float:\n    p = max(0.0, min(1.0, float(prior)))\n    lt = max(0.0, min(1.0, float(likelihood_if_true)))\n    lf = max(0.0, min(1.0, float(likelihood_if_false)))\n    num = p * lt\n    denom = num + (1.0 - p) * lf\n    if denom <= 0.0:\n        return 0.0\n    return num / denom",
    "domain": "agentic_reasoning"
  },
  {
    "name": "git_bisect_midpoint_step",
    "param_types": [
      "int",
      "int"
    ],
    "return_type": "int",
    "summary": "Compute the next binary-search commit index to test during automated regression bisection.",
    "pseudocode": "Algorithm git_bisect_midpoint_step(int, int) -> int:\n1. Receive typed arguments (int, int)\n2. Execute canonical calculation\n3. Return int",
    "invariants": [
      "min(good_idx, bad_idx) <= out <= max(good_idx, bad_idx)",
      "out == f(bad_idx, good_idx)"
    ],
    "pitfalls": [
      {
        "naive_pattern": "Unclamped division or unguarded zero/negative denominator in agent telemetry.",
        "failure_mechanism": "ZeroDivisionError or out-of-bounds score on degenerate inputs.",
        "counterexample_input": "0",
        "verified_fix": "Clamp denominator and domain boundaries before arithmetic evaluation."
      }
    ],
    "source_code": "def git_bisect_midpoint_step(good_idx: int, bad_idx: int) -> int:\n    lo = min(int(good_idx), int(bad_idx))\n    hi = max(int(good_idx), int(bad_idx))\n    if hi - lo <= 1:\n        return hi\n    return lo + (hi - lo) // 2",
    "domain": "agentic_reasoning"
  },
  {
    "name": "ucb1_tool_selection_score",
    "param_types": [
      "int",
      "int",
      "int",
      "float"
    ],
    "return_type": "float",
    "summary": "Compute Upper Confidence Bound (UCB1) bandit score for routing between candidate agent tools.",
    "pseudocode": "Algorithm ucb1_tool_selection_score(int, int, int, float) -> float:\n1. Receive typed arguments (int, int, int, float)\n2. Execute canonical calculation\n3. Return float",
    "invariants": [
      "out >= 0.0",
      "f(successes, pulls, total_pulls, 0.0) <= 1.0"
    ],
    "pitfalls": [
      {
        "naive_pattern": "Unclamped division or unguarded zero/negative denominator in agent telemetry.",
        "failure_mechanism": "ZeroDivisionError or out-of-bounds score on degenerate inputs.",
        "counterexample_input": "0",
        "verified_fix": "Clamp denominator and domain boundaries before arithmetic evaluation."
      }
    ],
    "source_code": "def ucb1_tool_selection_score(successes: int, pulls: int, total_pulls: int, exploration_c: float) -> float:\n    n = max(1, abs(int(pulls)))\n    s = max(0, min(n, abs(int(successes))))\n    t = max(1, abs(int(total_pulls)))\n    c = max(0.0, float(exploration_c))\n    mean_reward = s / float(n)\n    y = (float(t) - 1.0) / (float(t) + 1.0)\n    y2 = y * y\n    ln_t = 2.0 * y * (1.0 + y2 / 3.0 + y2 * y2 / 5.0 + y2 ** 3 / 7.0 + y2 ** 4 / 9.0 + y2 ** 5 / 11.0)\n    return mean_reward + c * (max(0.0, ln_t) / float(n)) ** 0.5",
    "domain": "agentic_reasoning"
  },
  {
    "name": "cross_family_consensus_verdict",
    "param_types": [
      "int",
      "int",
      "int",
      "float"
    ],
    "return_type": "bool",
    "summary": "Determine whether multi-agent verification passes quorum and has zero critical blockers.",
    "pseudocode": "Algorithm cross_family_consensus_verdict(int, int, int, float) -> bool:\n1. Receive typed arguments (int, int, int, float)\n2. Execute canonical calculation\n3. Return bool",
    "invariants": [
      "not (critical_flags > 0) or (out == False)",
      "out == True or out == False"
    ],
    "pitfalls": [
      {
        "naive_pattern": "Unclamped division or unguarded zero/negative denominator in agent telemetry.",
        "failure_mechanism": "ZeroDivisionError or out-of-bounds score on degenerate inputs.",
        "counterexample_input": "0",
        "verified_fix": "Clamp denominator and domain boundaries before arithmetic evaluation."
      }
    ],
    "source_code": "def cross_family_consensus_verdict(approvals: int, total_reviewers: int, critical_flags: int, min_quorum_ratio: float) -> bool:\n    if int(critical_flags) > 0:\n        return False\n    tot = max(1, abs(int(total_reviewers)))\n    app = max(0, min(tot, int(approvals)))\n    q = max(0.0, min(1.0, float(min_quorum_ratio)))\n    return app / float(tot) >= q",
    "domain": "agentic_reasoning"
  },
  {
    "name": "repair_loop_termination_decide",
    "param_types": [
      "int",
      "int",
      "int",
      "int"
    ],
    "return_type": "int",
    "summary": "Decide whether an automated test-fix-verify loop should halt due to success, budget exhaustion, or oscillation.",
    "pseudocode": "Algorithm repair_loop_termination_decide(int, int, int, int) -> int:\n1. Receive typed arguments (int, int, int, int)\n2. Execute canonical calculation\n3. Return int",
    "invariants": [
      "-2 <= out <= 1",
      "not (failing_tests <= 0) or (out == 1)"
    ],
    "pitfalls": [
      {
        "naive_pattern": "Unclamped division or unguarded zero/negative denominator in agent telemetry.",
        "failure_mechanism": "ZeroDivisionError or out-of-bounds score on degenerate inputs.",
        "counterexample_input": "0",
        "verified_fix": "Clamp denominator and domain boundaries before arithmetic evaluation."
      }
    ],
    "source_code": "def repair_loop_termination_decide(failing_tests: int, attempt: int, max_attempts: int, prev_failing_tests: int) -> int:\n    if int(failing_tests) <= 0:\n        return 1\n    if int(attempt) >= max(1, int(max_attempts)):\n        return -1\n    if int(attempt) > 1 and int(failing_tests) >= int(prev_failing_tests):\n        return -2\n    return 0",
    "domain": "agentic_reasoning"
  },
  {
    "name": "information_gain_split_score",
    "param_types": [
      "int",
      "int",
      "int",
      "int"
    ],
    "return_type": "float",
    "summary": "Compute Gini impurity reduction achieved by a diagnostic probe splitting candidate hypotheses.",